{
  "accent": "green",
  "caption": "将阿拉伯数字金额转换为人民币大写，适用于票据、合同与财务文案。",
  "category": "finance",
  "clipboardMatch": {
    "type": "decimal-amount",
    "priority": 81
  },
  "defaultAlias": "rmb",
  "entry": "index.html",
  "icon": "assets/icon.svg",
  "id": "tooldesk-rmb-uppercase",
  "keywords": [
    "dx",
    "rmbdx",
    "renminbidaxie",
    "rmb",
    "cny",
    "money",
    "人民币",
    "大写",
    "金额",
    "转换",
    "财务",
    "票据"
  ],
  "name": "人民币大小写",
  "permissions": [
    "clipboard"
  ],
  "publisher": "tooldesk",
  "version": "0.1.0",
  "manifestVersion": 1,
  "sdkVersion": "1.0.0",
  "minHostVersion": "0.1.0",
  "capabilities": [
    "copyText"
  ],
  "windowIcon": "assets/window-icon.png"
}
