{
  "accent": "green",
  "caption": "一键测试当前网络延迟、下载和上传速度。",
  "category": "dev",
  "defaultAlias": "wscs",
  "entry": "index.html",
  "icon": "assets/icon.svg",
  "id": "tooldesk-network-speed-test",
  "keywords": [
    "cs",
    "speed",
    "wangsucesu",
    "network",
    "wifi",
    "internet",
    "ping",
    "download",
    "upload",
    "测速",
    "网速",
    "网络",
    "延迟",
    "下载",
    "上传",
    "宽带"
  ],
  "name": "网络测速",
  "permissions": [
    "http"
  ],
  "publisher": "tooldesk",
  "version": "0.1.0",
  "manifestVersion": 1,
  "sdkVersion": "1.0.0",
  "minHostVersion": "0.1.0",
  "capabilities": [
    "sendHttpRequest"
  ],
  "windowIcon": "assets/window-icon.png"
}
